{
  "schema_name": "segment_transcript_comparison",
  "schema_version": "1.0.0",
  "artifact_id": "art_segment_transcript_compare",
  "project_id": "prj_demo",
  "revision_id": "rev_002",
  "created_at": "2026-07-24T12:00:00Z",
  "producer": {
    "application_version": "0.2.0",
    "stage": "segment-transcript-comparison",
    "adapter": "fixture-transcription",
    "adapter_version": "1.0.0"
  },
  "scope": {
    "segment_id": "segment_000001",
    "source_range": {"start_us": 0, "end_us": 6000000}
  },
  "intended_transcript": {
    "artifact_id": "art_transcript",
    "path": "C:/projects/prj_demo/artifacts/transcript.json",
    "sha256": "1111111111111111111111111111111111111111111111111111111111111111"
  },
  "rendered_transcript": {
    "artifact_id": "art_rendered_transcript_rev_002",
    "path": "C:/projects/prj_demo/revisions/rev_002/rendered-transcript.json",
    "sha256": "2222222222222222222222222222222222222222222222222222222222222222"
  },
  "revision_media": {
    "artifact_id": "art_revision_media_rev_002",
    "path": "C:/projects/prj_demo/revisions/rev_002/revision-media.json",
    "sha256": "3333333333333333333333333333333333333333333333333333333333333333"
  },
  "expected_words": [
    {
      "source_word_id": "wrd_000001",
      "text": "before",
      "source_start_us": 500000,
      "source_end_us": 1200000,
      "output_start_us": 500000,
      "output_end_us": 1200000
    }
  ],
  "rendered_words": [
    {"word_id": "wrd_000001", "text": "before", "start_us": 500000, "end_us": 1200000}
  ],
  "expected_sequence": ["before"],
  "rendered_sequence": ["before"],
  "missing_words": [],
  "unexpected_words": [],
  "duplicate_words": [],
  "ordering_match": true,
  "sequence_status": "pass",
  "warnings": [],
  "status": "complete"
}
